{"compatibility_sha256":"3ff878ee1daba60a8eb9058c0c07f5277dce4699580accacc2bbcfbd64a71384","django_apps":["buh_mining_analytics","buh_structure_ops","buh_moon_tax"],"platform_version":"0.5.2","schema_version":1,"setup_commands":["buh_mining_setup","buh_structure_ops_setup","buh_moon_tax_setup"],"wheels":[{"component":"aa-moonmining","distribution":"aa-moonmining","filename":"aa_moonmining-3.1.0.post1-py3-none-any.whl","sha256":"aa4ddbc7da64151cd6d988d971d59462360e35a5111d47a3bf56d577f454bc13","version":"3.1.0.post1"},{"component":"aa-structures","distribution":"aa-structures","filename":"aa_structures-4.0.3-py3-none-any.whl","sha256":"ba8493ef10a450198fa5ba3d8995e1ea661b74dca20d770beaa91bf005f558e3","version":"4.0.3"},{"component":"mining-analytics","distribution":"aa-buh-mining-analytics","filename":"aa_buh_mining_analytics-0.2.1-py3-none-any.whl","sha256":"241807bed3805f363c0a84352de82278d16bed98f6562953feaae6784ee2a240","version":"0.2.1"},{"component":"structure-ops","distribution":"aa-buh-structure-ops","filename":"aa_buh_structure_ops-0.3.1-py3-none-any.whl","sha256":"bd83e39f10b04fce9b90eb6c9bd06430ca7938db74cc93c4155042bcd40bb212","version":"0.3.1"},{"component":"moon-tax","distribution":"aa-buh-moon-tax","filename":"aa_buh_moon_tax-0.3.3-py3-none-any.whl","sha256":"a50cf827c5c9fd979d8f287efc7d13eb8f1284a53f92c4e5f8c88528693bdbd9","version":"0.3.3"}]}
