{"compatibility_sha256":"9c2bf892171a9abfa3cc0aff9a8df1e78e4e9cbc771ff282365d44fc36c8bbc4","django_apps":["buh_max_history","buh_memberaudit_autoreg","buh_mining_analytics","buh_structure_ops","buh_moon_tax","buh_vps_health"],"platform_version":"0.8.1","schema_version":1,"setup_commands":["buh_archive_setup","buh_mining_setup","buh_structure_ops_setup","buh_moon_tax_setup"],"wheels":[{"component":"aa-moonmining","distribution":"aa-moonmining","filename":"aa_moonmining-3.1.0.post1-py3-none-any.whl","sha256":"aa4ddbc7da64151cd6d988d971d59462360e35a5111d47a3bf56d577f454bc13","version":"3.1.0.post1"},{"component":"aa-structures","distribution":"aa-structures","filename":"aa_structures-4.0.3-py3-none-any.whl","sha256":"ba8493ef10a450198fa5ba3d8995e1ea661b74dca20d770beaa91bf005f558e3","version":"4.0.3"},{"component":"esi-history","distribution":"aa-buh-max-history","filename":"aa_buh_max_history-2.1.2-py3-none-any.whl","sha256":"adf116b02f024344da47190103078697523f71ae60412934f5e09506a36f80f5","version":"2.1.2"},{"component":"memberaudit-autoreg","distribution":"aa-buh-memberaudit-autoreg","filename":"aa_buh_memberaudit_autoreg-0.1.1-py3-none-any.whl","sha256":"519cd7f5fd6a4dcca68cdb79beba0fb0b4c80798e18973df50f2789ff1537ac6","version":"0.1.1"},{"component":"mining-analytics","distribution":"aa-buh-mining-analytics","filename":"aa_buh_mining_analytics-0.2.3-py3-none-any.whl","sha256":"4e649f6ff3baec5e456ad3a4720a3b1a30191c5398db11ee43e366360373ab13","version":"0.2.3"},{"component":"structure-ops","distribution":"aa-buh-structure-ops","filename":"aa_buh_structure_ops-0.3.6-py3-none-any.whl","sha256":"cd4967ce1ade37bdc65a95a41f1fd62a7566f4fc6d736818f9251dfdd3a1d107","version":"0.3.6"},{"component":"moon-tax","distribution":"aa-buh-moon-tax","filename":"aa_buh_moon_tax-0.3.5-py3-none-any.whl","sha256":"33d0312f0f62d71e314553f62c0252dcc0149d5fcb9076cc86d468bcf842121d","version":"0.3.5"},{"component":"vps-health","distribution":"aa-buh-vps-health","filename":"aa_buh_vps_health-0.2.1-py3-none-any.whl","sha256":"d53f7a39278d0e7449d117dcdc0f62f0ea6148f00df40785d7400a6fb528b76f","version":"0.2.1"}]}
