{"compatibility_sha256":"79ed7d91eea4d620d1c25fa5e6e21f8f81b885fe3c7ef397ec560f22c444ade3","django_apps":["buh_max_history","buh_mining_analytics","buh_structure_ops","buh_moon_tax"],"platform_version":"0.8.0","schema_version":1,"setup_commands":["buh_archive_setup","buh_mining_setup","buh_structure_ops_setup","buh_moon_tax_setup"],"wheels":[{"component":"aa-moonmining","distribution":"aa-moonmining","filename":"aa_moonmining-3.1.0.post1-py3-none-any.whl","sha256":"aa4ddbc7da64151cd6d988d971d59462360e35a5111d47a3bf56d577f454bc13","version":"3.1.0.post1"},{"component":"aa-structures","distribution":"aa-structures","filename":"aa_structures-4.0.3-py3-none-any.whl","sha256":"ba8493ef10a450198fa5ba3d8995e1ea661b74dca20d770beaa91bf005f558e3","version":"4.0.3"},{"component":"esi-history","distribution":"aa-buh-max-history","filename":"aa_buh_max_history-2.1.1-py3-none-any.whl","sha256":"cae23b4a4165eea1e47a916270a84b513d501f2744bf2943f7f566dc97ab3c24","version":"2.1.1"},{"component":"mining-analytics","distribution":"aa-buh-mining-analytics","filename":"aa_buh_mining_analytics-0.2.3-py3-none-any.whl","sha256":"4e649f6ff3baec5e456ad3a4720a3b1a30191c5398db11ee43e366360373ab13","version":"0.2.3"},{"component":"structure-ops","distribution":"aa-buh-structure-ops","filename":"aa_buh_structure_ops-0.3.6-py3-none-any.whl","sha256":"cd4967ce1ade37bdc65a95a41f1fd62a7566f4fc6d736818f9251dfdd3a1d107","version":"0.3.6"},{"component":"moon-tax","distribution":"aa-buh-moon-tax","filename":"aa_buh_moon_tax-0.3.5-py3-none-any.whl","sha256":"33d0312f0f62d71e314553f62c0252dcc0149d5fcb9076cc86d468bcf842121d","version":"0.3.5"}]}
